{
	"$schema": "http://json-schema.org/draft-04/schema#",
	"title": "",
	"description": "",
	"type": "object",
	"required": ["type", "identifier", "supportedCRS", "tileMatrix"],
	"properties": {
		"type": {
			"description": "Type of the Tile Matrix Set",
			"enum": ["TileMatrixSetType"]
		},
		"title": {
			"description": "Title of this tile matrix set, normally used for display to a human",
			"type": "string"
		},
		"abstract": {
			"description": "Brief narrative description of this tile matrix set, normally available for display to a human",
			"type": "string"
		},
		"keywords": {
			"description": "Unordered list of one or more commonly used or formalized word(s) or phrase(s) used to describe this dataset",
			"$ref": "#/definitions/keywords" 
		},
		"identifier": {
			"description": "Tile matrix set identifier",
			"type": "string"
		},
		"boundingBox":
		{
			"description": "Minimum bounding rectangle surrounding the tile matrix set, in the supported CRS",
			"$ref": "#/definitions/boundingBox" 
		},
		"supportedCRS": {
			"description": "Reference to one coordinate reference system (CRS)",
			"type": "string",
			"format": "uri"
		},
		"wellKnownScaleSet": {
			"description": "Reference to a well-known scale set",
			"type": "string",
			"format": "uri"
		},
		"tileMatrix":
		{
			"description": "Describes a scale level and its tile matrix",
			"$ref": "#/definitions/tileMatrix" 
		}
	},
	"definitions":{ 
		"keywords": {
			"description": "Unordered list of one or more commonly used or formalised word(s) or phrase(s) used to describe this resource",
			"type": "array",
			"items": {
				"type": "string"
			}
		},
		"boundingBox": {
			"description": "Minimum bounding rectangle surrounding the tile matrix set, in the supported CRS",
			"type": "object",
			"required": ["type", "lowerCorner", "upperCorner"],
			"properties": 
			{
				"type": {
					"description": "Type of the Bounding Bos",
					"enum": ["BoundingBoxType"]
				},
				"crs": {
					"description": "",
					"type": "string",
					"format": "uri"
				},
				"lowerCorner": {					
					"description": "",
					"type": "array",
					"items": {
						"type": "number",
						"minItems": 2,
						"maxItems": 2
					}
				},
				"upperCorner": {					
					"description": "",
					"type": "array",
					"items": {
						"type": "number",
						"minItems": 2,
						"maxItems": 2
					}
				}
			}
		},
		"tileMatrix": 
		{
			"description": "",
			"type": "array",
			"items": {
				"description": "",
				"type": "object",
				"required": ["type", "identifier", "scaleDenominator", "topLeftCorner", "tileWidth", "tileHeight", "matrixWidth", "matrixHeight"],
				"properties": 
				{
					"type": {
						"description": "Type of the Tile Matrix",
						"enum": ["TileMatrixType"]
					},
					"title": {
						"description": "Title of this tile matrix set, normally used for display to a human",
						"type": "string"
					},
					"abstract": {
						"description": "Brief narrative description of this tile matrix set, normally available for display to a human",
						"type": "string"
					},
					"keywords": {
						"description": "Unordered list of one or more commonly used or formalized word(s) or phrase(s) used to describe this dataset",
						"$ref": "#/definitions/keywords" 
					},
					"identifier": {
						"description": "Tile matrix identifier",
						"type": "string"
					},
					"scaleDenominator": {
						"description": "Scale denominator level of this tile matrix",
						"type": "number"
					},
					"topLeftCorner": {					
						"description": "Position in CRS coordinates of the top-left corner of this tile matrix",
						"type": "array",
						"items": {
							"type": "number",
							"minItems": 2,
							"maxItems": 2
						}
					},
					"tileWidth": {
						"description": "Width of each tile of this tile matrix in pixels",
						"type": "number",
						"minimum": 1,
						"multipleOf" : 1
					},
					"tileHeight": {
						"description": "Height of each tile of this tile matrix in pixels",
						"type": "number",
						"minimum": 1,
						"multipleOf" : 1
					},
					"matrixWidth": {
						"description": "Width of the matrix (number of tiles in width)",
						"type": "number",
						"minimum": 1,
						"multipleOf" : 1
					},
					"matrixHeight": {
						"description": "Height of the matrix (number of tiles in height)",
						"type": "number",
						"minimum": 1,
						"multipleOf" : 1
					},
					"variableMatrixWidth": {
						"description": "Describes the rows that has variable matix width",
						"$ref": "#/definitions/variableMatrixWidth" 
					}
				}
			}
		},
		"variableMatrixWidth": {
			"description": "List of data structures defining the tiles rows that was variable width",
			"type": "array",
			"items": {
				"description": "Variable Matrix Width data structure",
				"type": "object",
				"required": ["type", "coalesce", "minTileRow", "maxTileRow"],
				"properties": 
				{
					"type": {
						"description": "Type of the Variable Matrix Width",
						"enum": ["VariableMatrixWidthType"]
					},
					"coalesce" : {
						"description": "Coalescence factor",
						"type": "number",
						"minimum": 2,
						"multipleOf" : 1
					},
					"minTileRow": {
						"description": "Minimum tile row index valid for this layer",
						"type": "number",
						"minimum": 0,
						"multipleOf" : 1
					},
					"maxTileRow": {
						"description": "Maximim tile row index valid for this layer",
						"type": "number",
						"minimum": 0,
						"multipleOf" : 1
					}
				}
			}
		}
	}
}