{
	"type": "TileMatrixSetType",
	"title": "UTM31WGS84Quad",
	"identifier": "Universal Transverse Mercator Zone 31 WGS84 Quad",
	"boundingBox":
	{
		"type": "BoundingBoxType",
		"crs": "http://www.opengis.net/def/crs/EPSG/0/32631",
		"lowerCorner":
		[
			-9501965.72931276,
			-20003931.4586255
		],
		"upperCorner":
		[
			10501965.7293128,
			20003931.4586255
		]
	},
	"supportedCRS": "http://www.opengis.net/def/crs/EPSG/0/32631",
	"tileMatrix":
	[
		{
			"type": "TileMatrixType",
			"identifier": "1",
			"scaleDenominator": 279072704.500914,
			"topLeftCorner":
			[
				-9501965.72931276,
				20003931.4586255
			],
			"tileWidth": 256,
			"tileHeight": 256,
			"matrixWidth": 1,
			"matrixHeight": 2
		},
		{
			"type": "TileMatrixType",
			"identifier": "2",
			"scaleDenominator": 139536352.250457,
			"topLeftCorner":
			[
				-9501965.72931276,
				20003931.4586255
			],
			"tileWidth": 256,
			"tileHeight": 256,
			"matrixWidth": 2,
			"matrixHeight": 4
		},
		{
			"type": "TileMatrixType",
			"identifier": "3",
			"scaleDenominator": 69768176.1252285,
			"topLeftCorner":
			[
				-9501965.72931276,
				20003931.4586255
			],
			"tileWidth": 256,
			"tileHeight": 256,
			"matrixWidth": 4,
			"matrixHeight": 8
		},
		{
			"type": "TileMatrixType",
			"identifier": "4",
			"scaleDenominator": 34884088.0626143,
			"topLeftCorner":
			[
				-9501965.72931276,
				20003931.4586255
			],
			"tileWidth": 256,
			"tileHeight": 256,
			"matrixWidth": 8,
			"matrixHeight": 16
		},
		{
			"type": "TileMatrixType",
			"identifier": "5",
			"scaleDenominator": 17442044.0313071,
			"topLeftCorner":
			[
				-9501965.72931276,
				20003931.4586255
			],
			"tileWidth": 256,
			"tileHeight": 256,
			"matrixWidth": 16,
			"matrixHeight": 32
		},
		{
			"type": "TileMatrixType",
			"identifier": "6",
			"scaleDenominator": 8721022.01565356,
			"topLeftCorner":
			[
				-9501965.72931276,
				20003931.4586255
			],
			"tileWidth": 256,
			"tileHeight": 256,
			"matrixWidth": 32,
			"matrixHeight": 64
		},
		{
			"type": "TileMatrixType",
			"identifier": "7",
			"scaleDenominator": 4360511.00782678,
			"topLeftCorner":
			[
				-9501965.72931276,
				20003931.4586255
			],
			"tileWidth": 256,
			"tileHeight": 256,
			"matrixWidth": 64,
			"matrixHeight": 128
		},
		{
			"type": "TileMatrixType",
			"identifier": "8",
			"scaleDenominator": 2180255.50391339,
			"topLeftCorner":
			[
				-9501965.72931276,
				20003931.4586255
			],
			"tileWidth": 256,
			"tileHeight": 256,
			"matrixWidth": 128,
			"matrixHeight": 256
		},
		{
			"type": "TileMatrixType",
			"identifier": "9",
			"scaleDenominator": 1090127.7519567,
			"topLeftCorner":
			[
				-9501965.72931276,
				20003931.4586255
			],
			"tileWidth": 256,
			"tileHeight": 256,
			"matrixWidth": 256,
			"matrixHeight": 512
		},
		{
			"type": "TileMatrixType",
			"identifier": "10",
			"scaleDenominator": 545063.875978348,
			"topLeftCorner":
			[
				-9501965.72931276,
				20003931.4586255
			],
			"tileWidth": 256,
			"tileHeight": 256,
			"matrixWidth": 512,
			"matrixHeight": 1024
		},
		{
			"type": "TileMatrixType",
			"identifier": "11",
			"scaleDenominator": 272531.937989174,
			"topLeftCorner":
			[
				-9501965.72931276,
				20003931.4586255
			],
			"tileWidth": 256,
			"tileHeight": 256,
			"matrixWidth": 1024,
			"matrixHeight": 2048
		},
		{
			"type": "TileMatrixType",
			"identifier": "12",
			"scaleDenominator": 136265.968994587,
			"topLeftCorner":
			[
				-9501965.72931276,
				20003931.4586255
			],
			"tileWidth": 256,
			"tileHeight": 256,
			"matrixWidth": 2048,
			"matrixHeight": 4096
		},
		{
			"type": "TileMatrixType",
			"identifier": "13",
			"scaleDenominator": 68132.9844972935,
			"topLeftCorner":
			[
				-9501965.72931276,
				20003931.4586255
			],
			"tileWidth": 256,
			"tileHeight": 256,
			"matrixWidth": 4096,
			"matrixHeight": 8192
		},
		{
			"type": "TileMatrixType",
			"identifier": "14",
			"scaleDenominator": 34066.4922486467,
			"topLeftCorner":
			[
				-9501965.72931276,
				20003931.4586255
			],
			"tileWidth": 256,
			"tileHeight": 256,
			"matrixWidth": 8192,
			"matrixHeight": 16384
		},
		{
			"type": "TileMatrixType",
			"identifier": "15",
			"scaleDenominator": 17033.2461243234,
			"topLeftCorner":
			[
				-9501965.72931276,
				20003931.4586255
			],
			"tileWidth": 256,
			"tileHeight": 256,
			"matrixWidth": 16384,
			"matrixHeight": 32768
		},
		{
			"type": "TileMatrixType",
			"identifier": "16",
			"scaleDenominator": 8516.62306216168,
			"topLeftCorner":
			[
				-9501965.72931276,
				20003931.4586255
			],
			"tileWidth": 256,
			"tileHeight": 256,
			"matrixWidth": 32768,
			"matrixHeight": 65536
		},
		{
			"type": "TileMatrixType",
			"identifier": "17",
			"scaleDenominator": 4258.31153108084,
			"topLeftCorner":
			[
				-9501965.72931276,
				20003931.4586255
			],
			"tileWidth": 256,
			"tileHeight": 256,
			"matrixWidth": 65536,
			"matrixHeight": 131072
		},
		{
			"type": "TileMatrixType",
			"identifier": "18",
			"scaleDenominator": 2129.15576554042,
			"topLeftCorner":
			[
				-9501965.72931276,
				20003931.4586255
			],
			"tileWidth": 256,
			"tileHeight": 256,
			"matrixWidth": 131072,
			"matrixHeight": 262144
		},
		{
			"type": "TileMatrixType",
			"identifier": "19",
			"scaleDenominator": 1064.57788277021,
			"topLeftCorner":
			[
				-9501965.72931276,
				20003931.4586255
			],
			"tileWidth": 256,
			"tileHeight": 256,
			"matrixWidth": 262144,
			"matrixHeight": 524288
		},
		{
			"type": "TileMatrixType",
			"identifier": "20",
			"scaleDenominator": 532.288941385105,
			"topLeftCorner":
			[
				-9501965.72931276,
				20003931.4586255
			],
			"tileWidth": 256,
			"tileHeight": 256,
			"matrixWidth": 524288,
			"matrixHeight": 1048576
		},
		{
			"type": "TileMatrixType",
			"identifier": "21",
			"scaleDenominator": 266.144470692553,
			"topLeftCorner":
			[
				-9501965.72931276,
				20003931.4586255
			],
			"tileWidth": 256,
			"tileHeight": 256,
			"matrixWidth": 1048576,
			"matrixHeight": 2097152
		},
		{
			"type": "TileMatrixType",
			"identifier": "22",
			"scaleDenominator": 133.072235346276,
			"topLeftCorner":
			[
				-9501965.72931276,
				20003931.4586255
			],
			"tileWidth": 256,
			"tileHeight": 256,
			"matrixWidth": 2097152,
			"matrixHeight": 4194304
		},
		{
			"type": "TileMatrixType",
			"identifier": "23",
			"scaleDenominator": 66.5361176731382,
			"topLeftCorner":
			[
				-9501965.72931276,
				20003931.4586255
			],
			"tileWidth": 256,
			"tileHeight": 256,
			"matrixWidth": 4194304,
			"matrixHeight": 8388608
		},
		{
			"type": "TileMatrixType",
			"identifier": "24",
			"scaleDenominator": 33.2680588365691,
			"topLeftCorner":
			[
				-9501965.72931276,
				20003931.4586255
			],
			"tileWidth": 256,
			"tileHeight": 256,
			"matrixWidth": 8388608,
			"matrixHeight": 16777216
		}
	]
}