{
	"type": "TileMatrixSetType",
	"title": "CRS84 for the World",
	"identifier": "WorldCRS84Quad",
	"boundingBox":
	{
		"type": "BoundingBoxType",
		"crs": "http://www.opengis.net/def/crs/OGC/1.3/CRS84",
		"lowerCorner": [-180, -90],
		"upperCorner": [180, 90]
	},
	"supportedCRS": "http://www.opengis.net/def/crs/OGC/1.3/CRS84",
	"wellKnownScaleSet": "http://www.opengis.net/def/wkss/OGC/1.0/GoogleCRS84Quad",
	"tileMatrix":
	[
		{
			"type": "TileMatrixType",
			"identifier": "0",
			"scaleDenominator": 279541132.014358,
			"topLeftCorner": [-180, 90],
			"tileWidth": 256,
			"tileHeight": 256,
			"matrixWidth": 2,
			"matrixHeight": 1
		},
		{
			"type": "TileMatrixType",
			"identifier": "1",
			"scaleDenominator": 139770566.007179,
			"topLeftCorner": [-180, 90],
			"tileWidth": 256,
			"tileHeight": 256,
			"matrixWidth": 4,
			"matrixHeight": 2
		},
		{
			"type": "TileMatrixType",
			"identifier": "2",
			"scaleDenominator": 69885283.0035897,
			"topLeftCorner": [-180, 90],
			"tileWidth": 256,
			"tileHeight": 256,
			"matrixWidth": 8,
			"matrixHeight": 4
		},
		{
			"type": "TileMatrixType",
			"identifier": "3",
			"scaleDenominator": 34942641.5017948,
			"topLeftCorner": [-180, 90],
			"tileWidth": 256,
			"tileHeight": 256,
			"matrixWidth": 16,
			"matrixHeight": 8
		},
		{
			"type": "TileMatrixType",
			"identifier": "4",
			"scaleDenominator": 17471320.7508974,
			"topLeftCorner": [-180, 90],
			"tileWidth": 256,
			"tileHeight": 256,
			"matrixWidth": 32,
			"matrixHeight": 16
		},
		{
			"type": "TileMatrixType",
			"identifier": "5",
			"scaleDenominator": 8735660.37544871,
			"topLeftCorner": [-180, 90],
			"tileWidth": 256,
			"tileHeight": 256,
			"matrixWidth": 64,
			"matrixHeight": 32
		},
		{
			"type": "TileMatrixType",
			"identifier": "6",
			"scaleDenominator": 4367830.18772435,
			"topLeftCorner": [-180, 90],
			"tileWidth": 256,
			"tileHeight": 256,
			"matrixWidth": 128,
			"matrixHeight": 64
		},
		{
			"type": "TileMatrixType",
			"identifier": "7",
			"scaleDenominator": 2183915.09386217,
			"topLeftCorner": [-180, 90],
			"tileWidth": 256,
			"tileHeight": 256,
			"matrixWidth": 256,
			"matrixHeight": 128
		},
		{
			"type": "TileMatrixType",
			"identifier": "8",
			"scaleDenominator": 1091957.54693108,
			"topLeftCorner": [-180, 90],
			"tileWidth": 256,
			"tileHeight": 256,
			"matrixWidth": 512,
			"matrixHeight": 256
		},
		{
			"type": "TileMatrixType",
			"identifier": "9",
			"scaleDenominator": 545978.773465544,
			"topLeftCorner": [-180, 90],
			"tileWidth": 256,
			"tileHeight": 256,
			"matrixWidth": 1024,
			"matrixHeight": 512
		},
		{
			"type": "TileMatrixType",
			"identifier": "10",
			"scaleDenominator": 272989.386732772,
			"topLeftCorner": [-180, 90],
			"tileWidth": 256,
			"tileHeight": 256,
			"matrixWidth": 2048,
			"matrixHeight": 1024
		},
		{
			"type": "TileMatrixType",
			"identifier": "11",
			"scaleDenominator": 136494.693366386,
			"topLeftCorner": [-180, 90],
			"tileWidth": 256,
			"tileHeight": 256,
			"matrixWidth": 4096,
			"matrixHeight": 2048
		},
		{
			"type": "TileMatrixType",
			"identifier": "12",
			"scaleDenominator": 68247.346683193,
			"topLeftCorner": [-180, 90],
			"tileWidth": 256,
			"tileHeight": 256,
			"matrixWidth": 8192,
			"matrixHeight": 4096
		},
		{
			"type": "TileMatrixType",
			"identifier": "13",
			"scaleDenominator": 34123.6733415964,
			"topLeftCorner": [-180, 90],
			"tileWidth": 256,
			"tileHeight": 256,
			"matrixWidth": 16384,
			"matrixHeight": 8192
		},
		{
			"type": "TileMatrixType",
			"identifier": "14",
			"scaleDenominator": 17061.8366707982,
			"topLeftCorner": [-180, 90],
			"tileWidth": 256,
			"tileHeight": 256,
			"matrixWidth": 32768,
			"matrixHeight": 16384
		},
		{
			"type": "TileMatrixType",
			"identifier": "15",
			"scaleDenominator": 8530.91833539913,
			"topLeftCorner": [-180, 90],
			"tileWidth": 256,
			"tileHeight": 256,
			"matrixWidth": 65536,
			"matrixHeight": 32768
		},
		{
			"type": "TileMatrixType",
			"identifier": "16",
			"scaleDenominator": 4265.45916769956,
			"topLeftCorner": [-180, 90],
			"tileWidth": 256,
			"tileHeight": 256,
			"matrixWidth": 131072,
			"matrixHeight": 65536
		},
		{
			"type": "TileMatrixType",
			"identifier": "17",
			"scaleDenominator": 2132.72958384978,
			"topLeftCorner": [-180, 90],
			"tileWidth": 256,
			"tileHeight": 256,
			"matrixWidth": 262144,
			"matrixHeight": 131072
		}
	]	
}