{
	"type": "TileMatrixSetType",
	"title": "AntarcticUniversalPolarStereoWGS84Quad",
	"identifier": "Universal Polar Stereographic WGS 84 Quad for Antarctic",
	"boundingBox":
	{
		"type": "BoundingBoxType",
		"crs": "http://www.opengis.net/def/crs/EPSG/0/5042",
		"lowerCorner":
		[
			-14440759.350252,
			-14440759.350252
		],
		"upperCorner":
		[
			18440759.350252,
			18440759.350252
		]
	},
	"supportedCRS": "http://www.opengis.net/def/crs/EPSG/0/5042",
	"tileMatrix":
	[
		{
			"type": "TileMatrixType",
			"identifier": "0",
			"scaleDenominator": 458726544.4,
			"topLeftCorner":
			[
				-14440759.350252,
				18440759.350252
			],
			"tileWidth": 256,
			"tileHeight": 256,
			"matrixWidth": 1,
			"matrixHeight": 1
		},
		{
			"type": "TileMatrixType",
			"identifier": "1",
			"scaleDenominator": 229363272.2,
			"topLeftCorner":
			[
				-14440759.350252,
				18440759.350252
			],
			"tileWidth": 256,
			"tileHeight": 256,
			"matrixWidth": 2,
			"matrixHeight": 2
		},
		{
			"type": "TileMatrixType",
			"identifier": "2",
			"scaleDenominator": 114681636.1,
			"topLeftCorner":
			[
				-14440759.350252,
				18440759.350252
			],
			"tileWidth": 256,
			"tileHeight": 256,
			"matrixWidth": 4,
			"matrixHeight": 4
		},
		{
			"type": "TileMatrixType",
			"identifier": "3",
			"scaleDenominator": 57340818.05,
			"topLeftCorner":
			[
				-14440759.350252,
				18440759.350252
			],
			"tileWidth": 256,
			"tileHeight": 256,
			"matrixWidth": 8,
			"matrixHeight": 8
		},
		{
			"type": "TileMatrixType",
			"identifier": "4",
			"scaleDenominator": 28670409.02,
			"topLeftCorner":
			[
				-14440759.350252,
				18440759.350252
			],
			"tileWidth": 256,
			"tileHeight": 256,
			"matrixWidth": 16,
			"matrixHeight": 16
		},
		{
			"type": "TileMatrixType",
			"identifier": "5",
			"scaleDenominator": 14335204.51,
			"topLeftCorner":
			[
				-14440759.350252,
				18440759.350252
			],
			"tileWidth": 256,
			"tileHeight": 256,
			"matrixWidth": 32,
			"matrixHeight": 32
		},
		{
			"type": "TileMatrixType",
			"identifier": "6",
			"scaleDenominator": 7167602.256,
			"topLeftCorner":
			[
				-14440759.350252,
				18440759.350252
			],
			"tileWidth": 256,
			"tileHeight": 256,
			"matrixWidth": 64,
			"matrixHeight": 64
		},
		{
			"type": "TileMatrixType",
			"identifier": "7",
			"scaleDenominator": 3583801.128,
			"topLeftCorner":
			[
				-14440759.350252,
				18440759.350252
			],
			"tileWidth": 256,
			"tileHeight": 256,
			"matrixWidth": 128,
			"matrixHeight": 128
		},
		{
			"type": "TileMatrixType",
			"identifier": "8",
			"scaleDenominator": 1791900.564,
			"topLeftCorner":
			[
				-14440759.350252,
				18440759.350252
			],
			"tileWidth": 256,
			"tileHeight": 256,
			"matrixWidth": 256,
			"matrixHeight": 256
		},
		{
			"type": "TileMatrixType",
			"identifier": "9",
			"scaleDenominator": 895950.282,
			"topLeftCorner":
			[
				-14440759.350252,
				18440759.350252
			],
			"tileWidth": 256,
			"tileHeight": 256,
			"matrixWidth": 512,
			"matrixHeight": 512
		},
		{
			"type": "TileMatrixType",
			"identifier": "10",
			"scaleDenominator": 447975.141,
			"topLeftCorner":
			[
				-14440759.350252,
				18440759.350252
			],
			"tileWidth": 256,
			"tileHeight": 256,
			"matrixWidth": 1024,
			"matrixHeight": 1024
		},
		{
			"type": "TileMatrixType",
			"identifier": "11",
			"scaleDenominator": 223987.5705,
			"topLeftCorner":
			[
				-14440759.350252,
				18440759.350252
			],
			"tileWidth": 256,
			"tileHeight": 256,
			"matrixWidth": 2048,
			"matrixHeight": 2048
		},
		{
			"type": "TileMatrixType",
			"identifier": "12",
			"scaleDenominator": 111993.7852,
			"topLeftCorner":
			[
				-14440759.350252,
				18440759.350252
			],
			"tileWidth": 256,
			"tileHeight": 256,
			"matrixWidth": 4096,
			"matrixHeight": 4096
		},
		{
			"type": "TileMatrixType",
			"identifier": "13",
			"scaleDenominator": 55996.89262,
			"topLeftCorner":
			[
				-14440759.350252,
				18440759.350252
			],
			"tileWidth": 256,
			"tileHeight": 256,
			"matrixWidth": 8192,
			"matrixHeight": 8192
		},
		{
			"type": "TileMatrixType",
			"identifier": "14",
			"scaleDenominator": 27998.44631,
			"topLeftCorner":
			[
				-14440759.350252,
				18440759.350252
			],
			"tileWidth": 256,
			"tileHeight": 256,
			"matrixWidth": 16384,
			"matrixHeight": 16384
		},
		{
			"type": "TileMatrixType",
			"identifier": "15",
			"scaleDenominator": 13999.22316,
			"topLeftCorner":
			[
				-14440759.350252,
				18440759.350252
			],
			"tileWidth": 256,
			"tileHeight": 256,
			"matrixWidth": 32768,
			"matrixHeight": 32768
		},
		{
			"type": "TileMatrixType",
			"identifier": "16",
			"scaleDenominator": 6999.611578,
			"topLeftCorner":
			[
				-14440759.350252,
				18440759.350252
			],
			"tileWidth": 256,
			"tileHeight": 256,
			"matrixWidth": 65536,
			"matrixHeight": 65536
		},
		{
			"type": "TileMatrixType",
			"identifier": "17",
			"scaleDenominator": 3499.805789,
			"topLeftCorner":
			[
				-14440759.350252,
				18440759.350252
			],
			"tileWidth": 256,
			"tileHeight": 256,
			"matrixWidth": 131072,
			"matrixHeight": 131072
		},
		{
			"type": "TileMatrixType",
			"identifier": "18",
			"scaleDenominator": 1749.902894,
			"topLeftCorner":
			[
				-14440759.350252,
				18440759.350252
			],
			"tileWidth": 256,
			"tileHeight": 256,
			"matrixWidth": 262144,
			"matrixHeight": 262144
		},
		{
			"type": "TileMatrixType",
			"identifier": "19",
			"scaleDenominator": 874.9514472,
			"topLeftCorner":
			[
				-14440759.350252,
				18440759.350252
			],
			"tileWidth": 256,
			"tileHeight": 256,
			"matrixWidth": 524288,
			"matrixHeight": 524288
		},
		{
			"type": "TileMatrixType",
			"identifier": "20",
			"scaleDenominator": 437.4757236,
			"topLeftCorner":
			[
				-14440759.350252,
				18440759.350252
			],
			"tileWidth": 256,
			"tileHeight": 256,
			"matrixWidth": 1048576,
			"matrixHeight": 1048576
		},
		{
			"type": "TileMatrixType",
			"identifier": "21",
			"scaleDenominator": 218.7378618,
			"topLeftCorner":
			[
				-14440759.350252,
				18440759.350252
			],
			"tileWidth": 256,
			"tileHeight": 256,
			"matrixWidth": 2097152,
			"matrixHeight": 2097152
		},
		{
			"type": "TileMatrixType",
			"identifier": "22",
			"scaleDenominator": 109.3689309,
			"topLeftCorner":
			[
				-14440759.350252,
				18440759.350252
			],
			"tileWidth": 256,
			"tileHeight": 256,
			"matrixWidth": 4194304,
			"matrixHeight": 4194304
		},
		{
			"type": "TileMatrixType",
			"identifier": "23",
			"scaleDenominator": 54.68446545,
			"topLeftCorner":
			[
				-14440759.350252,
				18440759.350252
			],
			"tileWidth": 256,
			"tileHeight": 256,
			"matrixWidth": 8388608,
			"matrixHeight": 8388608
		},
		{
			"type": "TileMatrixType",
			"identifier": "24",
			"scaleDenominator": 27.34223273,
			"topLeftCorner":
			[
				-14440759.350252,
				18440759.350252
			],
			"tileWidth": 256,
			"tileHeight": 256,
			"matrixWidth": 16777216,
			"matrixHeight": 16777216
		}
	]
}